System_Ref,FIS_Registration_Name,Provider_Name,Service_Description,Note,Per_Hour,Total_Cost__Hour,Per_Day,Total_Cost__Day,Per_Session,Total_Cost__Session,Per_Week,Total_Cost__Week,Per_Term,Total_Cost__Term,Is_Free,Delivery_Channel_Description,First_Line,Second_Line,Third_Line,Town,Post_Code,Full_Address,Political_Ward_Description,Web_Site,Referral_Procedure,E_Mail,Telephone,Mobile,Availability_Start_Date,Availability_End_Date,Provider_Type_Description
11470,C.E.F. Lyncx Charity,SHARP Summer 2022 with CEF Lyncx,"SHARP (school holidays active & recreational programme) 
 
Our SHARP is offering opportunities for young people in Lambeth to engage in 25 days ‘Boot-Camp’ filled with structured active, recreation, learning and food programmes. 

Our SHARP Boot-Camp is for young people aged 7 to 16 and provides volunteering/work experience opportunities for young people aged 16 years and over and it will run from Monday, 25 July to Friday, 26 August (Monday to Friday). 
 
StEP (Saturdays the Extra Project)
Our Creative StEP is also running every Saturday throughout the summer holidays. This project run from our GreenHouse, the Brixton Windmill One O’clock Club building, Windmill Gardens SW2 5DA, a safe space where young people aged 11 to 16 years old can seize the opportunity to explore and develop their #Creative/Performing Arts skills; see This Clip, an example production by the young people leading our Creative StEP.
 
To find out more and to register, see poster and/or go to our website, https://cefi.org.uk/our-sharp-offer select ‘Project’ tab and then, ‘Our SHARP Offer’, scroll through and you will find all the information about these two initiatives of contact us directly. 

Suitable for children and young people with special educational needs and disabilities.
",Lunch provided,False,,False,,False,,False,,False,,True,Meeting a group of people,The Windmill Gardens (Park),Blenheim Gardens,Brixton Hill,London,SW2 5DA,"The Windmill Gardens (Park), Blenheim Gardens, London, SW2 5DA",Brixton Acre Lane,,,christian@cefi.org.uk,020 7737 4274,07706 179 851,7/25/2022 12:00:00 AM,8/26/2022 12:00:00 AM,Summer of Food and Fun 2022
11471,High Trees Community Development Trust,Tulse Hill Adventure Playground Summer Playscheme,"Open access holiday play sessions with activities including cooking, adventure play, forest school, multi sports, water fights, table tennis, woodwork, hair and beauty workshop, roller-skating and much more. Additional optional trips out including kayaking, water wipe out, flip out, BMX riding and a trip to the seaside.

We will have free lunch and snacks for everyone attending.

All children must complete a registration form to join. 

Children need to book onto trips in advance. All trips will take place on Thursdays.  
                                                                                 
Follow us on instagram @high_treescdt Twitter @HighTreesCDT and Facebook @hightreescommunity
","Come to our adventure playground and chose to take part in whatever you like. We will have planned activities including cooking, treasure hunt, sports activities, arts and crafts, water fights, team challenges and trips out. 

All you need to join is get a parent to fill in a registration form (which you can get by ringing, emailing us or popping by to one of our sessions). ",False,,False,,False,,False,,False,,True,Meeting a group of people,Tulse Hill Adventure Playground,Tulse Hill Estate,,London,SW2 2EY,"Tulse Hill Adventure Playground, Tulse Hill Estate, London, SW2 2EY",,https://www.high-trees.org/activities-for-young-people/,,youth@high-trees.org,020 8674 3975,,8/1/2022 12:00:00 AM,8/25/2022 12:00:00 AM,Summer of Food and Fun 2022
11472,Upper Norwood Library Trust,Upper Norwood Library Hub Summer Camps For Children,"Performing Arts August summer camp 1-5 August & 8-12 August
Your young performers will have the opportunity to discover new skills, techniques and make some new friends as they spend the holidays having fun, creating and exploring drama, movement and music.                    
         
Little Brushstrokes: August summer camp 15-19 August & 22-26 August 
Your young budding artists will have the opportunity to discover new skills, techniques and learn about famous artists form around the world and their work as they spend the holidays having fun, creating and exploring art.

All the sessions are facilitated by local artist Cherelle Morris of Brushstrokes Art. 

Parents/carers will be responsible at all times for ensuring that children to do not attend on the day if they are showing any signs or symptoms or illness. 

Hand washing will be regular and compulsory for all children and staff throughout the days.

Please note, children will be provided with a healthy lunch
Please send them with a water bottle as well as suitable clothing for each day.

Price: free for families who receive free school meals

Drop off and pick up is at the back of the library on Beardell Street.

Please double check your ticket type before finalising any purchases.

If you have any other questions or require clarification, please contact us via email or telephone.
","- During the performing arts weeks you will have fun learning acting, drama and improvisation. 

- During the visual arts weeks you will have fun learning arts & crafts activities, things like drawing painting and sculpture. 
",False,,True,30,False,,False,,False,,False,Meeting a group of people,Upper Norwood Library Hub,39 Westow Hill,,London,SE19 1TJ,"Upper Norwood Library Hub, 39 Westow Hill, London, SE19 1TJ",,https://www.uppernorwoodlibraryhub.org/summercamps2022,,info@unlt.org,020 8670 4321,,8/1/2022 12:00:00 AM,8/26/2022 12:00:00 AM,Summer of Food and Fun 2022
11474,Lambeth Tigers,Lambeth Tigers Summer Camp,"Football Camp - Drills and skills, strength and conditioning, 1v1’s and Football matches.

Football Kit including socks, shin pads and astroturfs or studded boots or T-shirt and Shorts with a pair of trainers and some shin pads. Sent the children with plenty of water.

Carousel of skills and drills for the first 2 hours and then a hour lunch break. After lunch they will then participate in a football match and incorporate all the skills that they learned earlier in the day.
",,False,,False,,False,,False,,False,,True,Meeting a group of people,Myatt’s Field Park,Cormont Road,,London,SE5 9RA,"Myatt’s Field Park, Cormont Road, London, SE5 9RA",Myatt's Fields,https://lambeth-tigers-football-club.class4kids.co.uk/,,info@lambethTigersfc.org,0808 1088 160,,7/25/2022 12:00:00 AM,9/2/2022 12:00:00 AM,Summer of Food and Fun 2022
11475,Lerato Community Initiative,Lerato Summer Camp,"Daily Multi-sports, including badminton and rounders, arts and crafts, indoor and outdoor play, table games Baking, Tie-dye & music workshops. Trip to Stubbers Adventure Centre in Essex for water sports, climbing & target sports, trip to Gravity for e-karting & bowling, talent show. Time to just relax, socialise and make new friends.

Suitable for children and young people with special educational needs and disabilities","Booking process with web link for online registration, hot meal & drinks. 

Follow us on Instagram @leratocic and Twitter @LeratoCIC

Activities that challenge, build self-esteem and confidence. Onsite activities such as multi-sport, arts and crafts, music, baking, plus trips to adventure centres for water sports, climbing, e-karting and bowling.
",False,,False,,False,,True,10,False,,False,Meeting a group of people,Mursell Community Hall,Portland Grove,Stockwell,London,SW8 1JB,"Mursell Community Hall, Portland Grove, London, SW8 1JB",,https://www.leratocommunityinitiative.org.uk/,,info@leratocommunityinitiative.org.uk,020 8033 2375,,8/1/2022 12:00:00 AM,8/26/2022 12:00:00 AM,Summer of Food and Fun 2022
11476,Lifelong Family Links,Summer HAF Lifelong Family Links,"Activities will include cycling at our partner organisation Wheels for Well-being, bowling, swimming, football, gym work, boating at Crystal Palace Boating Lake and adventure playground sessions at Willington Road. We will also offer fruit picking sessions and visits to Godstone Farm where participants will be encouraged to interact with the animals. In addition to our trained play staff, we will be using trained disability sports coaches from Active Living, Disability Sport Coach and Lambeth Sport.

Our sessions are fun and safe for disabled young people we will pick up and drop off young people.We will also offer practical cooking and baking sessions. In addition, we will lead and encourage discussions on healthy lifestyles. In recognition of the importance of healthy eating to SEND young people in particular, we will also offer advice to participants’ parents/carers on providing nutritious and low-cost food.

Suitable for children and young people with special educational needs and disabilities.
",,False,,False,,False,,False,,False,,True,Meeting a group of people,1 Barstow Crescent,Laburnum Close,Palace Road,London,SW2 3NS,"1 Barstow Crescent, Laburnum Close, London, SW2 3NS",,,,admin1@lifelongfamilylinks.org.uk,020 8671 8939,,8/1/2022 12:00:00 AM,8/26/2022 12:00:00 AM,Summer of Food and Fun 2022
11478,Brixton Topcats,Brixton Topcats Summer Basketball Camp,"Brixton Topcats Summer Basketball Camp provides fun and engaging basketball sessions for children and young people aged 5 - 15. Topcats have been running their summer basketball camps for over three decades. This year our camps will be delivered by our team of highly experienced coaches. 

Camps are suitable for beginners and more experienced players and involve a variety of game-based activities that help children and young people have fun, be active and develop a range of skills. 

Follow our social media and website for more information and booking details. @brixton.topcats and brixtontopcats.org

",,False,,False,,False,,False,,False,,True,Meeting a group of people,Brixton Recreation Centre,Brixton Station Road,,London,SW9 8QQ,"Brixton Recreation Centre, Brixton Station Road, London, SW9 8QQ",,https://www.brixtontopcats.org/,,southlondontopcats@gmail.com,07894 452 505,,8/1/2022 12:00:00 AM,8/25/2022 12:00:00 AM,Summer of Food and Fun 2022
11480,Uk Latin Community Cic,Latin Holiday Camp Notre Dame,"We will deliver a programme that will focus on Arts and crafts, food and nutrition, sports and well-being. 
Our schedule will include a healthy lunch, one hour of structured physical activities such as dance and multi-sports, an hour of arts and crafts such as creating musical instruments out of recyclable materials, an hour of healthy eating awareness, as well as outdoor activities such as visiting the local city farm, visiting a local museum or a local attraction. 

We will share healthy recipes with parents to learn about healthy eating and put it into practice at home.

Suitable for children and young people with special educational needs and disabilities.
","https://forms.gle/UNZYgndiJnnE8nZS9

UK Latin Community will be hosting a Food and Fun Camp. We will deliver a programme focused on Arts and crafts, food and nutrition, multi-sports and well-being. 

Our schedule will include a healthy lunch, one hour of structured physical activities such as dance and multi-sports, an hour of arts and crafts such as creating musical instruments out of recyclable materials, an hour of healthy eating awareness, as well as outdoor activities such as visiting the local city farm, visiting a local museum or a local attraction.",False,,False,,False,,False,,False,,True,Meeting a group of people,Notre Dame Community Hall,Worsopp Drive,,London,SW4 9QU,"Notre Dame Community Hall, Worsopp Drive, London, SW4 9QU",,https://uklatincommunity.org/foodfun-holiday-camp,,info@uklatincommunity.org,07852 167 580,07491 993 524,7/25/2022 12:00:00 AM,8/18/2022 12:00:00 AM,Summer of Food and Fun 2022
11481,Living Space Bankside Open Spaces Trust,Football Food & Fun With Bankside Open Spaces Trust,"Professionally coached football sessions, adventure play, pool, table tennis, Xbox. cookery and food.

Come along to play some football, hang out and play pool, table tennis, help prepare lunch, learn nutrition or enjoy the adventure playground.

Suitable for children and young people with special educational needs and disabilities","Please note the session times are 13:00 to 18:00 and 11:00 to 16:00, contact the provider for more information. 

You can register through this link https://forms.office.com/r/HUv8CYVU00
",False,,False,,False,,False,,False,,True,Meeting a group of people,Living Space,1 Coral Street,,London,SE1 7BE,"Living Space, 1 Coral Street, London, SE1 7BE",Bishop's,,,livingspace@bost.org.uk,020 8127 4392,,7/27/2022 12:00:00 AM,8/26/2022 12:00:00 AM,Summer of Food and Fun 2022

