System_Ref,FIS_Registration_Name,Provider_Name,Service_Description,Note,Per_Hour,Total_Cost__Hour,Per_Day,Total_Cost__Day,Per_Session,Total_Cost__Session,Per_Week,Total_Cost__Week,Per_Term,Total_Cost__Term,Is_Free,Delivery_Channel_Description,First_Line,Second_Line,Third_Line,Town,Post_Code,Full_Address,Political_Ward_Description,Web_Site,Referral_Procedure,E_Mail,Telephone,Mobile,Availability_Start_Date,Availability_End_Date,Provider_Type_Description
11408,Autism Voice,Summer Holiday Food And Fun Activities For Autistic Children,"We will provide the following activities: indoor and outdoor sports, arts and crafts, music and dance, food matters workshop, Lego therapy, Free play, Sensory activities, Water play, Messy play, Gardening, Nature walk and Trips out. 

For booking and referral please call or email us. 
","All our activities are SEND focus. Expect a fun and nonjudgmental environment where autistic children are encouraged and supported to be themselves.  

Follow us on social media @autismvoice1",False,,False,,False,,False,,False,,True,Meeting a group of people,161 - 167 Clapham Manor Street,,,London,SW4 6DB,"161 - 167 Clapham Manor Street, , London, SW4 6DB",,https://www.autismvoice.org.uk/,,autismvoice1@gmail.com,07460 399 290,,7/25/2022 12:00:00 AM,8/26/2022 12:00:00 AM,Summer of Food and Fun 2022
11413,Whippersnappers Cic,Whippersnappers Summer Playscheme 2022,"Is your child:

- Entitled to free school meals
- between the ages of 8 to 16 years old
- a Lambeth resident?

If the answer to all the questions above is yes then we have limited free places available at the Whippersnapper Summer playscheme  which is funded by Lambeth HAF

Everyday Whippersnappers will offer the children a menu of physical activities that young people can choose from. Activities can include;

- Swimming
- Dance
- Yoga
- Zumba
- Outdoor games in the park i.e. rounders, obstacle races, football, basketball, and tennis.

We will also encourage the young people ages 14 to 16 to lead in the activities if they have relevant skills in sports or physical activity with support from our playworkers.

Suitable for children and young people with special educational needs and disabilities.
","Free for children with free school meals.

Our site includes a kitchen, eating area and large studio space with dance mirrors, gym mats, a stage, a sound system and disco lights. We are also working in partnership with Fusion Lifestyle which has offered free access to the outdoor lido swimming pool.

The club is an inclusive setting for eight to sixteen-year-olds. On arrival, our playworkers will support the young people to prepare a healthy meal which they will sit down and eat together in our dining area.

Please note the mobile number is only in use 10am to 7pm Tuesday to Friday. 
",False,,False,,False,,False,,False,,False,Meeting a group of people,Brockwell Lido,Dulwich Road,,London,SE24 0PA,"Brockwell Lido, Dulwich Road, London, SE24 0PA",,,,yjama@whippersnappers.org,020 7738 6633,07949 425 025,7/25/2022 12:00:00 AM,8/12/2022 12:00:00 AM,Summer of Food and Fun 2022
11414,Vauxhall Gardens Community Centre,Culture Chic Shock Play Scheme With Vauxhall Gardens Community Centre,"Combined arts and play scheme for 8 to 16 year olds. 

Join us for a series of dance, drama, arts and crafts and music workshops celebrating London's diverse colourful and multicultural heritage through an exploration of music and fashion and food.

Suitable for children and young people with special educational needs and disabilities.
","Spaces limited, book by email through admin@vgcc.org.uk, subject: culture chic shock. 

Meals provided.

",False,,False,,False,,False,,False,,False,Meeting a group of people,5 Glasshouse Walk,,,London,SE11 5ES,"5 Glasshouse Walk, , London, SE11 5ES",,http://www.vgcc.org.uk/,,sophyab@vgcc.org.uk,07907 333 108,,8/1/2022 12:00:00 AM,8/20/2022 12:00:00 AM,Summer of Food and Fun 2022
11415,Uk Latin Community Cic,Latin Holiday Camp Vauxhall 5 Community Centre,"We will deliver a programme that will focus on Arts and crafts, food and nutrition, sports and well-being.

Our schedule will include a healthy lunch, one hour of structured physical activities such as dance and multi-sports, an hour of arts and crafts such as creating musical instruments out of recyclable materials, an hour of healthy eating awareness, as well as outdoor activities such as visiting the local city farm, visiting a local museum or a local attraction. 

We will share healthy recipes with parents to learn about healthy eating and put it into practice at home.

Suitable for children and young people with special educational needs and disabilities.
","https://forms.gle/dywWJPBLrkXYJ3eE8

UK Latin Community will be hosting a Food and Fun Camp. We will deliver a programme focused on Arts and crafts, food and nutrition, multi-sports and well-being. 

Our schedule will include a healthy lunch, one hour of structured physical activities such as dance and multi-sports, an hour of arts and crafts such as creating musical instruments out of recyclable materials, an hour of healthy eating awareness, as well as outdoor activities such as visiting the local city farm, visiting a local museum or a local attraction.
",False,,False,,False,,False,,False,,True,Meeting a group of people,Vauxhall Five Community Centre,St Oswald's Place,,London,SE11 5JF,"Vauxhall Five Community Centre, St Oswald's Place, London, SE11 5JF",,https://uklatincommunity.org/,,info@uklatincommunity.org,07852 167 580,07491 993 524,7/25/2022 12:00:00 AM,8/18/2022 12:00:00 AM,Summer of Food and Fun 2022
11417,Triangle Adventure Playground,Triangle Adventure Playground Summer Holiday Playscheme,"Triangle Adventure Playground will be offering adventure play, sports, arts & crafts, outdoor play, games, nature play and free play.
 
Suitable for children and young people with special educational needs and disabilities.

","Young people must be registered via our website before attending the playground for the first time. 

http://triangleadventureplayground.com/parents-info-1

Twitter - https://twitter.com/TRIANGLE_APG

IG - https://www.instagram.com/triangle_adventure_playground/

A fun and playful open access adventure playground for  6 to 17 years old, with outdoor play, arts and crafts, sports, trips, learning new skills, making new friends and space to chill. 

Come and go as you please once registered!
",False,,False,,False,,False,,False,,True,Meeting a group of people,Ashmole Street,,,London,SW8 1NE,"Ashmole Street, , London, SW8 1NE",Oval,http://triangleadventureplayground.com/,,triangleapg@gmail.com,07900 475 143,,7/25/2022 12:00:00 AM,9/2/2022 12:00:00 AM,Summer of Food and Fun 2022
11419,The Boury Academy,Summer 2022 With The Boury Academy,"Join us this Summer for an exciting week of workshops!
Participants will create a Show In A Week! They will have classes in dance, drama and singing all with the Amazing Boury Academy Teachers and be ready to perform a full musical in just five days!

Mini B''s for ages 4 to 7 years old will run every day between 10:00 to 13:00.
 
Our Main School will run from 10:00 to 16:00 every day.
 
LUNCH INCLUDED FOR ALL PARTICIPANTS!

We hope to safely produce a performance at 5.30pm for main school and 12pm for Minis on the last day of the week
",,False,,False,,False,,False,,False,,True,Meeting a group of people,Lilian Baylis School,Kennington Road,Oval,London,SE11 5BZ,"Lilian Baylis School, Kennington Road, London, SE11 5BZ",,,,info@thebouryacademy.co.uk,07487 309 247,,7/25/2022 12:00:00 AM,7/29/2022 12:00:00 AM,Summer of Food and Fun 2022
11431,Old Library Youth Club,Rathbone Summer Fit And Fun Activities Programme,"A fun packed summer programme filled with a diverse range of sports and other physical activities suitable for all abilities. Young people will have the opportunity to participate in creative arts and crafts, digital and social media workshops, music and indoor games. At the heart of our programme will be our 'Chef and Share' cooking sessions, young people will prepare a healthy balanced meal that all young people will sit down to eat. The menu will be planned weekly utilizing our Phunky food nutritional resource and eat well meal planning guide.
Each week will culminate with enrichment trips to fun offsite places of interest. (Trips will be chargeable).

This is a NUT FREE site. No food containing nuts will be permitted on site. 

Suitable for children and young people with special educational needs and disabilities.

","Our activities 1can accomodate young people with SEND up to the age 25 years old. 

Free to access onsite days however offsite  trips are chargeable, please ask us for more information. 
",False,,False,,False,,False,,False,,False,Meeting a group of people,The Old Library ,14 - 16 Knight's Hill,,London,SE27 0HY,"The Old Library , 14 - 16 Knight's Hill, London, SE27 0HY",,https://rathbonesociety.org.uk/,,c.king@rathbonesociety.org.uk,020 8766 9280,,7/26/2022 12:00:00 AM,8/26/2022 12:00:00 AM,Summer of Food and Fun 2022
11435,Parallel Youth Enterprise,Lambeth Summer Camp Parallel Youth Enterprise,"During July and August, we will deliver an 18 day  programme of workshops, trips out and sport at St Marin in the Fields School Tulse Hill for one hundred and fifty young people.

There will be over 14 diverse on-site workshops which will include music,  dance, computers, filming, beautician, circus skills, hair care, face painting and arts & crafts. We can offer an ongoing day long sports timetable which will include badminton, football, table tennis, cricket, 
","Family rates and concessions available please let us know if you would like more information. 

Free places to eligible children as part of Lambeth's Summer of Food and Fun programme. 

Our project is ideal for young people experiencing circumstances of hardship where they can access and enjoy activities that perhaps, for many would not be attainable.

The Workshops and Sport are delivered in a safe environment and with encouragement and support. Together these will improve talents, physical and mental well-being, and a healthier lifestyle.

The projects offer some an alternative to young people being involved in anti-social conduct and crime, or perhaps being a victim of crime. The projects are an ideal non-confrontational platform for both police officers and young people to meet. This often helps develop harmony from both sides.

Discovering new skills and understanding within the project workshops can be a foundation stone for future personal development and maybe a route out of deprivation and a road to employment and self-esteem.
",False,,True,10,False,,False,,False,,False,Meeting a group of people,St Martin In The Fields High School,155 Tulse Hill,,London,SW2 3UP,"St Martin In The Fields High School, 155 Tulse Hill, London, SW2 3UP",,http://www.lambethsummercamps.org/,,street.john@talk21.com,07767 352 610,,7/26/2022 12:00:00 AM,8/18/2022 12:00:00 AM,Summer of Food and Fun 2022
11436,Omnibus - Clapham,Routes With Omnibus Theatre,"Alongside receiving breakfast, lunch and healthy snacks, 15 to 20 young people work together under the guidance of our facilitators to create their own production which they perform to friends and family at the end of the week in our Theatre. The aims for the week are simple; to have fun, work as a team, challenge yourself and use your imagination!

Suitable for children and young people with special educational needs and disabilities.
","Routes at Omnibus Theatre is a chance to create your very own play, working with a group of other young people, based on whatever story you want to tell. 
At the end of the week, you will perform the play you have created in our theatre, with lighting, sound and costume. Each day you will also join us for a tasty breakfast and lunch, including a pizza party on the final day!
",False,,False,,False,,False,,False,,True,Meeting a group of people,Omnibus Theatre Clapham ,1 Clapham Common North Side,,London,SW4 0QW,"Omnibus Theatre Clapham , 1 Clapham Common North Side, London, SW4 0QW",,http://www.omnibus-clapham.org/,,felicity.paterson@omnibus-clapham.org,0207 622 4105,,8/1/2022 12:00:00 AM,8/26/2022 12:00:00 AM,Summer of Food and Fun 2022
11440,Norwood Community Group Services,Karate/ Fitness Training And Self Defence Classes,"Norwood Community Group Services invites you to attend our Karate, Fitness & Self Defence classes. You will become accredited (AQA) with the skills that will not only help you to defend yourself. Casual dress is recommended (track suit). 

Teaching children how to deal with confrontational situation. How to deal with the streets and how best to conduct themselves. All ways to live in harmony. 

We will also provide each young person with a food box at the end of each session.
","All users will be required to complete a membership/registration form when joining our programs, Parents/carers must complete this process.

Sessions; 
Monday - Karate and fitness classes
Tuesday - Fitness training and self defence classes ",False,,True,,False,,False,,False,,True,Meeting a group of people,Elmgreen School,Elmcourt Road,,London,SE27 9BZ,"Elmgreen School, Elmcourt Road, West Norwood , London, SE27 9BZ",,https://norwoodcommunitygroup.co.uk/sports/free-karate-fitness-training-and-self-defence-activities-throughout-the-summer/,,info@norwoodcommunitygroup.co.uk,0208 766 9286,07931 919 585,7/25/2022 12:00:00 AM,8/30/2022 12:00:00 AM,Summer of Food and Fun 2022
11453,Kennington Park Community Centre,KPCC's Summer Of Fun And Food 2022,"KPCC and our partners, Simply Smiley Productions, will be offering a programme of fun and creative activities 4 days a week for 5 weeks this summer. A free, healthy hot lunch, cooked on-site, as well as fruit and snacks, will be provided every day; and at the end of the week children will be invited to ‘shop’ for food kindly donated by the Felix Project to take home with them. 

Activities will include hula-hooping, karate, yoga, drama, dressing up, dance, arts and crafts, and much more! Our kids love growing and eating healthy plants, so this summer we have a Living Wall project. On top of that, we are planning to introduce the children to Shakespeare’s Midsummer Night’s Dream with the help of professional theatre companies. We are also planning to walk the children across the Park to Kennington Park Centre Adventure Playground and take the bus to Max Roach and Slade Gardens adventure playgrounds.

Suitable for children and young people with special educational needs and disabilities.
","Online registration form at http://kpccoval.org/

Many of our staff and volunteers are professional actors and creatives, and love creating exciting and imaginative activities with the children. Our families are keen to come back every holidays and we always have a waiting list. KPCC is where kids make friends, learn new stuff, and enjoy tasty, healthy food, eating together at the table and learning about nutrition, as well as having oodles of fun dressing up, dancing and creating their own plays, stories and everlasting memories.
",False,,False,,False,,False,,False,,True,Meeting a group of people,8 Harleyford Street,,,London,SE11 5SY,"8 Harleyford Street, , London, SE11 5SY",,http://kpccoval.org/,,kpccsummer@gmail.com,0800 776 5587,07931 959 636,7/25/2022 12:00:00 AM,8/25/2022 12:00:00 AM,Summer of Food and Fun 2022
11454,The Kinetika Bloco,Kinetika Bloco Junior Summer School,"The Junior Summer School will see 100 young people come together to learn either drums, steel pans, brass or woodwind. Over the 5 days the young people will learn tunes and develop skills together and on the final day perform a carnival showcase. 

Young people do not need any experience to sign up for drums or steel pans, but need to have access to an instrument and know the basic notes to join brass or woodwind.

The course is free, however you are welcome to give a donation of £15 if you are able to.

To sign up please register at www.kinetikabloco.co.uk/join-us by filling in the form.

Participating in Junior Summer School is a great way to develop your creative skills in an instrument and also develop your social skills as you come together with 100 other young people. There will be opportunities for games, team building, health and wellbeing sessions and lots of FUN! You also get to perform to your friends and family at the end of the week sharing all of the amazing tunes you have learnt together.",,False,,False,,False,,False,,False,,True,Meeting a group of people,Streatham Wells Primary School,50 Palace Road,,London,SW2 3NJ,"Streatham Wells Primary School, 50 Palace Road, London, SW2 3NJ",Stockwell East,https://www.kinetikabloco.co.uk/,,tamzyn@kinetikabloco.co.uk,07795 142 535,,7/25/2022 12:00:00 AM,7/29/2022 12:00:00 AM,Summer of Food and Fun 2022
11455,The Kinetika Bloco,Kinetika Bloco Senior Summer School,"Kinetika Bloco Senior Summer School brings young people together to learn and play brass and woodwind, steel pans, drums and dance to create a spectacular costumed show. Over 10 days we will learn music together and develop creative and social skills and then perform on the final day to a huge audience at the Royal Festival Hall. 

Following the summer school young people will be invited back to be a part of many performances through the year including Notting Hill Carnival, the London Jazz Festival and many more.

£35 but free bursary places are available.

Please book your place at www.kinetikabloco.co.uk/join-us

At Senior Summer School you will get the opportunity to make loads of new friends and develop your creative skills in dance or music. You'll also get the chance to develop performance skills, improvisation, communication, develop a network of likeminded individuals and have a lot of FUN! You'll create a performance together that will showcase your talent as part of a large band of young people.
",,False,,False,,False,,False,,False,,True,Meeting a group of people,Royal Festival Hall,South Bank,,London,SE1 8XX,"Royal Festival Hall, South Bank, London, SE1 8XX",,https://www.kinetikabloco.co.uk/join-us/,,tamzyn@kinetikabloco.co.uk,07795 142 535,,7/25/2022 12:00:00 AM,8/12/2022 12:00:00 AM,Summer of Food and Fun 2022
11456,198 Cal/& Photofusion’s Galleries,Artist Minds With 198 Contemporary Arts And Learning And Photofusion,"The project will be photography, Photowalks, shooting in a photography studio, T-shirt design and art and crafts.

Please email us for more information. 
","The workshop will have at least one hour of structured physical activity through photgraphy, games etc.  These workshops aim to demonstrate how creativity can be used to improve health and wellbeing by using photography and graphics as the primary tool. Each session, a different artistic technique will be demonstrated and practised, so that participants can experience a range of skills to try out.  

During each session, information about mental health and healthy eating will be presented and discussed in the group, whilst undertaking the activity which will allow for a space where participants can be creative, social and share ideas. 

Part of summer school we will be providing lunch for all participants. 
",False,,False,,False,,False,,False,,True,Meeting a group of people,198 Contemporary Arts and Learning,Railton Road,Herne Hill,London,SE24 0JT,"198 Contemporary Arts and Learning, Railton Road, London, SE24 0JT",,https://www.198.org.uk/,,thefactoryproductionhouse@photofusion.org,020 7978 8309,,8/8/2022 12:00:00 AM,8/26/2022 12:00:00 AM,Summer of Food and Fun 2022
11457,Activities 4 U,Activities 4 U Multisports and Arts Camp,"Multi-sports & Arts Camp 5+ Years- An enriching programme of fun and engaging activities over the summer, including:

-Sports and Dance Workshops
-Arts and Crafts
-Trips including the beach, theatre and more!
-Drama workshops
-Team games

A wide range of fun activities throughout the summer, learn new skills, gain new experiences and meet new friends!

",,False,,True,22,False,,False,,False,,True,Meeting a group of people,Harris Academy (Clapham) ,Clarence Avenue,,London,SW4 8LD,"Harris Academy (Clapham) , Clarence Avenue, London, SW4 8LD",,https://activities4u.org.uk/,,admin@activities4u.org.uk,020 7735 8181,,7/25/2022 12:00:00 AM,8/25/2022 12:00:00 AM,Summer of Food and Fun 2022
11462,Living Space Bankside Open Spaces Trust,Oasis Summer Activities At Living Space,"Teens summer activities run by Oasis Youth Hub at Living Space in Waterloo including cooking, arts and crafts, outdoor sports in football cage, CV and school prep, various workshops.

Hang out with your peers to take part in interesting activities, chill out or make it high energy - its up to you. Lots of activities to chose from, also mentoring from experienced youth workers if you need a chat!","The sessions will run on Monday's, Tuesday's, Wednesday's and Friday's but the times vary. please email Jordan Gayle for more information. 

Booking in advance is essential. 
",False,,False,,False,,False,,False,,True,Meeting a group of people,Living Space,1 Coral Street,,London,SE1 7BE,"Living Space, 1 Coral Street, London, SE1 7BE",Bishop's,,,Jordan.Gayle@oasiswaterloo.org,020 7921 4209,,7/25/2022 12:00:00 AM,8/26/2022 12:00:00 AM,Summer of Food and Fun 2022
11463,BiG (Besty's Inspirational Guidance),BIG Summer 2022 Holiday Football Programme,"Enrol for our 2 programmes in 1 holiday activity - a football programme for children and young people (CYP) between 7 and 13 years old, and work experience opportunity for teenagers between 14 and 16 years old.  
Participants are welcomed Monday to Friday from 9:30am to practice their starter challenges. The football programme which officially commences at 10am will engage CYP in exciting, fun and developmental activities and football matches throughout the day. The activities provide a lot of physical exercise, and through challenging team challenges, also provide a platform for CYP to exercise their brains with ‘stretchy’ learning, which develop resilience.

Through BiG’s popular points system, CYP will develop key personal, social and transferable skills such as team working and will be educated about healthy lifestyles including nutrition.

Suitable for children and young people with special educational needs and disabilities.
","Please contact the provider directly for more information regarding delivery times and prices. 

You will engage in fun football activities in a family-like environment. You can be at any level and you will still be welcome and will not feel out of place. You will get lots of physical exercise, and through challenging yourself, with exercise your brain as well as testing yourself in a safe fun environment with ‘stretchy’ learning, which will develop your resilience.

You will develop other skills such as team working through our popular reward system while meeting new friends.

",False,,False,,False,,False,,False,,False,Meeting a group of people,Rosendale Playing Field,Rosendale Road,,London,SE21 8LW,"Rosendale Playing Field, Rosendale Road, London, SE21 8LW",,https://www.bigcic.org/,,lionel.best@bigcic.org,07908 950 630,,8/1/2022 12:00:00 AM,8/19/2022 12:00:00 AM,Summer of Food and Fun 2022
11465,Big Up Communities,Big Up Communities At The Stewarts Road Adventure Playground Summer Playscheme,"We will be running a summer playscheme for young people aged 8 to 16 years. Activities include adventure play, football, basketball, organised games, music production, MMA fitness and art and crafts.

For up to date information of our activities please follow us on Instagram @bigupcommunities ",,False,,False,,False,,False,,False,,True,Meeting a group of people,The Stewarts Road adventure Playground,,,London,SW8 4UG,"The Stewarts Road adventure Playground, , London, SW8 4UG",,https://www.bigupcommunities.com/,,admin@bigupcommunities.com,07436 918 367,,8/8/2022 12:00:00 AM,8/19/2022 12:00:00 AM,Summer of Food and Fun 2022
11466,Bigkid Foundation,BIGKID Summer Holiday programme,"BIGKID Summer Holiday programme is a 4 week programme filled with different activities Monday to Friday. Each day we will be open for 4 hours and run sports and youth club activities. The sports activities include but are not limited to basketball, roller skating, American flag football and fitness. 

All sessions are free and catered towards 11 to 18yr olds, food and refreshments will be provided. Some sessions will be held at Larkhall Park, contact us for more details.

We're operating from both Dexters Adventure Playground and Larkhall Park. Instagram - Bigkidfoundation Twitter - BIGKIDCharity. When attending sports sessions we would recommend wearing appropriate trainers (Larkhall Sessions require plastic studded boots).",,False,,False,,False,,False,,False,,True,Meeting a group of people,Dexters Adventure Playground,6 Montego Close ,,London,SE24 0LH,"Dexters Adventure Playground, 6 Montego Close , London, SE24 0LH",,https://www.bigkidfoundation.org/,,unika@bigkidfoundation.org,07865 274 806,,7/25/2022 12:00:00 AM,8/19/2022 12:00:00 AM,Summer of Food and Fun 2022
